{
  "$schema": "https://json-schema.org/draft/2020-12/schema",
  "type": "object",
  "required": ["language", "ui", "search", "outline", "notices", "seo"],
  "properties": { "$schema": { "type": "string" }, "language": { "type": "object" }, "ui": { "type": "object" }, "search": { "type": "object" }, "outline": { "type": "object" }, "notices": { "type": "object" }, "seo": { "type": "object" } },
  "additionalProperties": false
}
